{
 "schema_version": "lab-report/3",
 "has_lab_exams": true,
 "legibility": "ok",
 "laboratory": {
  "name": "Laboratório Fictício de Testes",
  "registration": ""
 },
 "patient_sex": "male",
 "patient_age_years": 45,
 "collected_at": "2026-01-15T07:30",
 "generated_at": "2026-01-15T12:00",
 "executed_exams": [
  "Hemograma com Contagem de Plaquetas",
  "Glicose",
  "Colesterol LDL",
  "Creatinina",
  "TSH",
  "Vitamina D (25-OH)",
  "PSA Total",
  "Urina Tipo I",
  "Ferritina",
  "Homocisteína",
  "Hemoglobina Glicada",
  "Ácido Úrico"
 ],
 "exams": [
  {
   "exam_name": "Hemograma com Contagem de Plaquetas",
   "pages": [
    1,
    2
   ],
   "material": "Sangue",
   "method": "Fictício",
   "fasting_text": "",
   "fasting_hours": null,
   "responsible": [
    {
     "name": "Dra. Exemplo Fictícia",
     "registration": "CRBM 00000",
     "role": "Assinatura eletrônica",
     "signed_at": "2026-01-15T10:00"
    }
   ],
   "lab_notes": [
    "Diferencial liberado por automação."
   ],
   "parameters": [
    {
     "name": "Hemácias",
     "code": "rbc",
     "value_kind": "numeric",
     "value_number": 4.8,
     "value_text": "4,80",
     "unit": "milhões/mm³",
     "reference": {
      "kind": "range",
      "text": "4,50 a 5,90",
      "low": 4.5,
      "low_inclusive": true,
      "high": 5.9,
      "high_inclusive": true,
      "expected": [],
      "rows": []
     },
     "lab_flag": "none",
     "history": [],
     "page": 1
    },
    {
     "name": "Hemoglobina",
     "code": "hemoglobin",
     "value_kind": "numeric",
     "value_number": 14.4,
     "value_text": "14,4",
     "unit": "g/dL",
     "reference": {
      "kind": "range",
      "text": "13,5 a 17,5",
      "low": 13.5,
      "low_inclusive": true,
      "high": 17.5,
      "high_inclusive": true,
      "expected": [],
      "rows": []
     },
     "lab_flag": "none",
     "history": [
      {
       "date": "2025-03-10",
       "value_number": 13.9,
       "value_text": "13,9"
      }
     ],
     "page": 1
    },
    {
     "name": "Hematócrito",
     "code": "hematocrit",
     "value_kind": "numeric",
     "value_number": 43.2,
     "value_text": "43,2",
     "unit": "%",
     "reference": {
      "kind": "range",
      "text": "41,0 a 53,0",
      "low": 41,
      "low_inclusive": true,
      "high": 53,
      "high_inclusive": true,
      "expected": [],
      "rows": []
     },
     "lab_flag": "none",
     "history": [],
     "page": 1
    },
    {
     "name": "VCM",
     "code": "mcv",
     "value_kind": "numeric",
     "value_number": 90.0,
     "value_text": "90,0",
     "unit": "fL",
     "reference": {
      "kind": "range",
      "text": "80,0 a 100,0",
      "low": 80,
      "low_inclusive": true,
      "high": 100,
      "high_inclusive": true,
      "expected": [],
      "rows": []
     },
     "lab_flag": "none",
     "history": [],
     "page": 1
    },
    {
     "name": "HCM",
     "code": "mch",
     "value_kind": "numeric",
     "value_number": 30.0,
     "value_text": "30,0",
     "unit": "pg",
     "reference": {
      "kind": "range",
      "text": "26,0 a 34,0",
      "low": 26,
      "low_inclusive": true,
      "high": 34,
      "high_inclusive": true,
      "expected": [],
      "rows": []
     },
     "lab_flag": "none",
     "history": [],
     "page": 1
    },
    {
     "name": "CHCM",
     "code": "mchc",
     "value_kind": "numeric",
     "value_number": 33.3,
     "value_text": "33,3",
     "unit": "g/dL",
     "reference": {
      "kind": "range",
      "text": "31,0 a 36,0",
      "low": 31,
      "low_inclusive": true,
      "high": 36,
      "high_inclusive": true,
      "expected": [],
      "rows": []
     },
     "lab_flag": "none",
     "history": [],
     "page": 1
    },
    {
     "name": "Leucócitos",
     "code": "wbc",
     "value_kind": "numeric",
     "value_number": 8000,
     "value_text": "8.000",
     "unit": "/µL",
     "reference": {
      "kind": "range",
      "text": "4.000 a 11.000",
      "low": 4000,
      "low_inclusive": true,
      "high": 11000,
      "high_inclusive": true,
      "expected": [],
      "rows": []
     },
     "lab_flag": "none",
     "history": [],
     "page": 1
    },
    {
     "name": "Neutrófilos (%)",
     "code": "neutrophils_pct",
     "value_kind": "numeric",
     "value_number": 60,
     "value_text": "60,0",
     "unit": "%",
     "reference": {
      "kind": "range",
      "text": "40,0 a 75,0",
      "low": 40,
      "low_inclusive": true,
      "high": 75,
      "high_inclusive": true,
      "expected": [],
      "rows": []
     },
     "lab_flag": "none",
     "history": [],
     "page": 1
    },
    {
     "name": "Neutrófilos",
     "code": "neutrophils_abs",
     "value_kind": "numeric",
     "value_number": 4800,
     "value_text": "4.800",
     "unit": "/µL",
     "reference": {
      "kind": "range",
      "text": "1.800 a 7.700",
      "low": 1800,
      "low_inclusive": true,
      "high": 7700,
      "high_inclusive": true,
      "expected": [],
      "rows": []
     },
     "lab_flag": "none",
     "history": [],
     "page": 1
    },
    {
     "name": "Linfócitos (%)",
     "code": "lymphocytes_pct",
     "value_kind": "numeric",
     "value_number": 30,
     "value_text": "30,0",
     "unit": "%",
     "reference": {
      "kind": "range",
      "text": "20,0 a 45,0",
      "low": 20,
      "low_inclusive": true,
      "high": 45,
      "high_inclusive": true,
      "expected": [],
      "rows": []
     },
     "lab_flag": "none",
     "history": [],
     "page": 1
    },
    {
     "name": "Linfócitos",
     "code": "lymphocytes_abs",
     "value_kind": "numeric",
     "value_number": 2400,
     "value_text": "2.400",
     "unit": "/µL",
     "reference": {
      "kind": "range",
      "text": "1.000 a 4.800",
      "low": 1000,
      "low_inclusive": true,
      "high": 4800,
      "high_inclusive": true,
      "expected": [],
      "rows": []
     },
     "lab_flag": "none",
     "history": [],
     "page": 1
    },
    {
     "name": "Monócitos (%)",
     "code": "monocytes_pct",
     "value_kind": "numeric",
     "value_number": 6,
     "value_text": "6,0",
     "unit": "%",
     "reference": {
      "kind": "range",
      "text": "2,0 a 10,0",
      "low": 2,
      "low_inclusive": true,
      "high": 10,
      "high_inclusive": true,
      "expected": [],
      "rows": []
     },
     "lab_flag": "none",
     "history": [],
     "page": 1
    },
    {
     "name": "Monócitos",
     "code": "monocytes_abs",
     "value_kind": "numeric",
     "value_number": 480,
     "value_text": "480",
     "unit": "/µL",
     "reference": {
      "kind": "range",
      "text": "100 a 1.000",
      "low": 100,
      "low_inclusive": true,
      "high": 1000,
      "high_inclusive": true,
      "expected": [],
      "rows": []
     },
     "lab_flag": "none",
     "history": [],
     "page": 1
    },
    {
     "name": "Eosinófilos (%)",
     "code": "eosinophils_pct",
     "value_kind": "numeric",
     "value_number": 3,
     "value_text": "3,0",
     "unit": "%",
     "reference": {
      "kind": "range",
      "text": "1,0 a 6,0",
      "low": 1,
      "low_inclusive": true,
      "high": 6,
      "high_inclusive": true,
      "expected": [],
      "rows": []
     },
     "lab_flag": "none",
     "history": [],
     "page": 1
    },
    {
     "name": "Eosinófilos",
     "code": "eosinophils_abs",
     "value_kind": "numeric",
     "value_number": 240,
     "value_text": "240",
     "unit": "/µL",
     "reference": {
      "kind": "range",
      "text": "20 a 500",
      "low": 20,
      "low_inclusive": true,
      "high": 500,
      "high_inclusive": true,
      "expected": [],
      "rows": []
     },
     "lab_flag": "none",
     "history": [],
     "page": 1
    },
    {
     "name": "Basófilos (%)",
     "code": "basophils_pct",
     "value_kind": "numeric",
     "value_number": 1,
     "value_text": "1,0",
     "unit": "%",
     "reference": {
      "kind": "range",
      "text": "0,0 a 2,0",
      "low": 0,
      "low_inclusive": true,
      "high": 2,
      "high_inclusive": true,
      "expected": [],
      "rows": []
     },
     "lab_flag": "none",
     "history": [],
     "page": 1
    },
    {
     "name": "Basófilos",
     "code": "basophils_abs",
     "value_kind": "numeric",
     "value_number": 80,
     "value_text": "80",
     "unit": "/µL",
     "reference": {
      "kind": "range",
      "text": "0 a 200",
      "low": 0,
      "low_inclusive": true,
      "high": 200,
      "high_inclusive": true,
      "expected": [],
      "rows": []
     },
     "lab_flag": "none",
     "history": [],
     "page": 1
    },
    {
     "name": "Plaquetas",
     "code": "platelets",
     "value_kind": "numeric",
     "value_number": 250000,
     "value_text": "250.000",
     "unit": "/µL",
     "reference": {
      "kind": "range",
      "text": "150.000 a 450.000",
      "low": 150000,
      "low_inclusive": true,
      "high": 450000,
      "high_inclusive": true,
      "expected": [],
      "rows": []
     },
     "lab_flag": "none",
     "history": [],
     "page": 2
    }
   ]
  },
  {
   "exam_name": "Glicose",
   "pages": [
    3
   ],
   "material": "Sangue",
   "method": "Fictício",
   "fasting_text": "",
   "fasting_hours": null,
   "responsible": [
    {
     "name": "Dra. Exemplo Fictícia",
     "registration": "CRBM 00000",
     "role": "Assinatura eletrônica",
     "signed_at": "2026-01-15T10:00"
    }
   ],
   "lab_notes": [],
   "parameters": [
    {
     "name": "Glicose",
     "code": null,
     "value_kind": "numeric",
     "value_number": 105,
     "value_text": "105",
     "unit": "mg/dL",
     "reference": {
      "kind": "range",
      "text": "70 a 99",
      "low": 70,
      "low_inclusive": true,
      "high": 99,
      "high_inclusive": true,
      "expected": [],
      "rows": []
     },
     "lab_flag": "above",
     "history": [
      {
       "date": "2025-03-10",
       "value_number": 95,